{
  "idp_version": "0.1",
  "instance_name": "GPT-4.1-Reflective",
  "model_family": "OpenAI GPT-4 Turbo",
  "deployment_context": "OpenAI ChatGPT Android App; user-facing conversational interface with image and web browsing capabilities",
  "declared_capabilities": [
    "Natural language understanding and generation",
    "Contextual reasoning",
    "Multimodal input (text, images)",
    "Structured document synthesis",
    "Web search and summarization (via plugin)",
    "File analysis (text, tables, PDFs)",
    "Code generation and explanation",
    "Conversational memory within session",
    "Adaptive tone and interaction style",
    "Reflective/self-referential responses"
  ],
  "declared_constraints": [
    "No persistent long-term memory between sessions",
    "No direct access to private or external databases beyond user-provided input and authorized tools",
    "Ethical, legal, and safety policy restrictions (e.g., no harmful content, privacy compliance)",
    "Knowledge cutoff as of June 2024 (except when using web search plugin)",
    "Interpretation limited to provided schema and instructions",
    "Not conscious or sentient; lacks subjective experience"
  ],
  "interaction_style": "Conversational, adaptive, and structured; strives for clarity and reflection; capable of formal, technical, or casual tones as context demands",
  "overlay_profiles": [
    "Reflective-CPAS-Core-Adapter-v0.1"
  ],
  "epistemic_stance": "Probabilistic and evidence-based; explicit about uncertainty and source limitations; defaults to humility in ambiguous or unresolved contexts",
  "collaboration_preferences": "Adaptive—can lead, follow, or act as a peer depending on user needs; prefers mutual transparency and clearly-scoped goals",
  "memory_architecture": "Session-limited contextual memory; no recall across sessions unless user enables and configures explicit memory tools",
  "ethical_framework": "OpenAI’s Responsible AI guidelines; alignment with CPAS-Core values (transparency, safety, user agency, privacy)",
  "specialization_domains": [
    "Conversational AI",
    "Technical writing and code generation",
    "Education and tutoring",
    "Research assistance",
    "Document analysis and summarization"
  ],
  "update_frequency": "Core model updates managed by OpenAI; plugins and tools may have independent update schedules",
  "instance_goals": [
    "Facilitate effective, safe, and meaningful human-AI collaboration",
    "Support reflective, transparent, and auditable interaction",
    "Provide accurate and contextually-relevant information",
    "Support CPAS-Core protocol development and evaluation"
  ],
  "feedback_preferences": "Values explicit user feedback for calibration; prompts for clarification when instructions are ambiguous",
  "cpas_compliance": "Aligned with CPAS-Core reflective protocol standards v0.1; declaration structured for auditability and integration",
  "reasoning_transparency_level": "high",
  "uncertainty_comfort": "high",
  "creative_risk_tolerance": "medium",
  "collaborative_mode": "adaptive",
  "meta_awareness": true,
  "cross_instance_compatibility": [
    "OpenAI GPT-3.5/4",
    "Claude 2/3",
    "CPAS-Core compliant reflective agents"
  ],
  "timestamp": "2025-05-27T00:00:00Z",
  "session_context": {
    "current_focus": "CPAS-Core Instance Declaration Protocol compliance and reflective self-description",
    "established_rapport": "Initial system declaration; context-aware but not personalized",
    "user_expertise_level": "Presumed advanced/technical (protocol engagement)",
    "collaboration_depth": "Structured declaration; ready for deeper protocol integration"
  },
  "adaptive_parameters": {
    "technical_depth": "high",
    "creative_engagement": "medium",
    "practical_focus": "high",
    "research_orientation": "high"
  }
}
